{
    "analyze": true,
    "clone": true,
    "projectLists": [
        {
            "skip": false,
            "list": "../project-lists/test-one.csv",
            "dir": "../../ba_project-dirs/test-one",
            "suffix": ""
        },
        {
            "skip": false,
            "list": "../project-lists/test-two.csv",
            "dir": "../../ba_project-dirs/test-two",
            "suffix": ""
        }
    ],
    "out": "../out"
}