{
    "analyze": true,
    "clone": true,
    "projectLists": [
        {
            "list": "../project-lists/projects_name_asc-stars-10.csv",
            "dir": "../../ba_project-dirs/projects_name_asc-stars-10"
        },
        {
            "skip": false,
            "list": "../project-lists/test.csv",
            "dir": "",
            "suffix": ""
        }
    ],
    "out": "../out",
    "verbose": false
}